{
 "main_gun": {
  "id": "gun_custom_75_l48",
  "caliber_mm": 75,
  "barrel_length_mm": 3600,
  "recoil_mm": 415,
  "rounds_per_min": 16.8,
  "reload_s": 3.6,
  "traverse_deg_s": 19.1,
  "elevate_deg_s": 12.7,
  "max_depression_deg": 8,
  "max_elevation_deg": 20,
  "dispersion_mrad": 1.14,
  "mass_kg": 667,
  "ammo": [
   "ap_custom_75_l48"
  ]
 },
 "mount_m": [
  -0.22,
  1.482,
  2.745
 ],
 "muzzle_offset_m": 3.096,
 "sight": {
  "name": "工坊瞄準鏡",
  "levels": [
   {
    "magnification": 3,
    "fov_deg": 16
   },
   {
    "magnification": 6,
    "fov_deg": 8
   }
  ],
  "rangefinder": {
   "time_s": 1.8,
   "error_pct": 3,
   "max_range_m": 3000
  }
 },
 "secondary": [],
 "rack_m": [
  0.604,
  1.482,
  1.259
 ],
 "loaders_m": [
  [
   0.378,
   1.4,
   1.63
  ]
 ],
 "facing_deg": 0,
 "yaw_limit_deg": [
  -120,
  120
 ],
 "extra_guns": [
  {
   "gun": {
    "id": "gun_custom_75_l48",
    "caliber_mm": 75,
    "barrel_length_mm": 3600,
    "recoil_mm": 415,
    "rounds_per_min": 16.8,
    "reload_s": 3.6,
    "traverse_deg_s": 19.1,
    "elevate_deg_s": 12.7,
    "max_depression_deg": 8,
    "max_elevation_deg": 20,
    "dispersion_mrad": 1.14,
    "mass_kg": 667,
    "ammo": [
     "ap_custom_75_l48"
    ]
   },
   "mount_m": [
    0.22,
    1.482,
    2.745
   ],
   "muzzle_offset_m": 3.096,
   "rack_m": [
    0.604,
    1.482,
    1.259
   ]
  }
 ],
 "extra_turrets": [
  {
   "id": "t2",
   "position_m": [
    0,
    1.85,
    -0.1
   ],
   "ring_diameter_m": 1.5,
   "size_m": [
    1.93,
    0.808,
    2.375
   ],
   "traverse_deg_s": 12.8,
   "facing_deg": 0,
   "loaders_m": [
    [
     0.405,
     2.15,
     -0.22
    ],
    [
     -0.405,
     2.15,
     -0.22
    ]
   ],
   "sight": {
    "name": "工坊瞄準鏡",
    "levels": [
     {
      "magnification": 3,
      "fov_deg": 16
     },
     {
      "magnification": 6,
      "fov_deg": 8
     }
    ],
    "rangefinder": {
     "time_s": 1.8,
     "error_pct": 3,
     "max_range_m": 3000
    }
   },
   "guns": [
    {
     "gun": {
      "id": "gun_custom_88_l56",
      "caliber_mm": 88,
      "barrel_length_mm": 4928,
      "recoil_mm": 444,
      "rounds_per_min": 11.3,
      "reload_s": 5.3,
      "traverse_deg_s": 12.8,
      "elevate_deg_s": 10.7,
      "max_depression_deg": 8,
      "max_elevation_deg": 20,
      "dispersion_mrad": 0.97,
      "mass_kg": 1064,
      "ammo": [
       "ap_custom_88_l56"
      ]
     },
     "mount_m": [
      -0.246,
      2.254,
      0.967
     ],
     "muzzle_offset_m": 4.238,
     "rack_m": [
      0.665,
      2.254,
      -0.622
     ]
    },
    {
     "gun": {
      "id": "gun_custom_88_l56",
      "caliber_mm": 88,
      "barrel_length_mm": 4928,
      "recoil_mm": 444,
      "rounds_per_min": 11.3,
      "reload_s": 5.3,
      "traverse_deg_s": 12.8,
      "elevate_deg_s": 10.7,
      "max_depression_deg": 8,
      "max_elevation_deg": 20,
      "dispersion_mrad": 0.97,
      "mass_kg": 1064,
      "ammo": [
       "ap_custom_88_l56"
      ]
     },
     "mount_m": [
      0.246,
      2.254,
      0.967
     ],
     "muzzle_offset_m": 4.238,
     "rack_m": [
      0.665,
      2.254,
      -0.622
     ]
    }
   ]
  },
  {
   "id": "t3",
   "position_m": [
    0,
    1.1,
    -1.95
   ],
   "ring_diameter_m": 1.3,
   "size_m": [
    1.686,
    0.63,
    2.085
   ],
   "traverse_deg_s": 27,
   "facing_deg": 180,
   "yaw_limit_deg": [
    -120,
    120
   ],
   "loaders_m": [
    [
     0.351,
     1.4,
     -2.07
    ]
   ],
   "sight": {
    "name": "工坊瞄準鏡",
    "levels": [
     {
      "magnification": 3,
      "fov_deg": 16
     },
     {
      "magnification": 6,
      "fov_deg": 8
     }
    ],
    "rangefinder": {
     "time_s": 1.8,
     "error_pct": 3,
     "max_range_m": 3000
    }
   },
   "guns": [
    {
     "gun": {
      "id": "gun_custom_37_l45",
      "caliber_mm": 37,
      "barrel_length_mm": 1665,
      "recoil_mm": 331,
      "rounds_per_min": 33.7,
      "reload_s": 1.8,
      "traverse_deg_s": 27,
      "elevate_deg_s": 14,
      "max_depression_deg": 8,
      "max_elevation_deg": 20,
      "dispersion_mrad": 1.21,
      "mass_kg": 153,
      "ammo": [
       "ap_custom_37_l45"
      ]
     },
     "mount_m": [
      -0.144,
      1.415,
      -1.027
     ],
     "muzzle_offset_m": 1.432,
     "rack_m": [
      0.543,
      1.415,
      -2.409
     ]
    },
    {
     "gun": {
      "id": "gun_custom_37_l45",
      "caliber_mm": 37,
      "barrel_length_mm": 1665,
      "recoil_mm": 331,
      "rounds_per_min": 33.7,
      "reload_s": 1.8,
      "traverse_deg_s": 27,
      "elevate_deg_s": 14,
      "max_depression_deg": 8,
      "max_elevation_deg": 20,
      "dispersion_mrad": 1.21,
      "mass_kg": 153,
      "ammo": [
       "ap_custom_37_l45"
      ]
     },
     "mount_m": [
      0.144,
      1.415,
      -1.027
     ],
     "muzzle_offset_m": 1.432,
     "rack_m": [
      0.543,
      1.415,
      -2.409
     ]
    }
   ]
  }
 ]
}
